{
  "schema": "tau.generated_ticket.v1",
  "github": {
    "repo": "grahama1970/chatgpt-lab"
  },
  "goal": {
    "goal_id": "goal-2026-06-greenfield-001",
    "goal_version": 1,
    "goal_hash": "sha256:607ad418a0ccc0499b8b069225794d51f3a5e985825e5ef324bcba0df2c555a5"
  },
  "previous_subagent": "chatgpt-pro",
  "context": {
    "summary": "The controller needs a new bounded review ticket.",
    "artifacts": [
      "controller-state/current.json"
    ]
  },
  "ticket": {
    "kind": "issue",
    "title": "Review Tau handoff contract ergonomics",
    "body": "Review whether the compact Tau handoff is easier for agents to produce reliably."
  },
  "requested_work": "Run contract validators and review the compact authoring schema.",
  "rationale": "The harness needs an agent-friendly front-door contract before runtime orchestration.",
  "next_agent": {
    "name": "reviewer",
    "executor": "either",
    "reason": "This is a read-only validation task."
  },
  "required_evidence": [
    "validator output",
    "reviewer comment"
  ],
  "stop_condition": "Reviewer posts PASS, NEEDS_CHANGES, BLOCKED, or INSUFFICIENT_EVIDENCE.",
  "goal_amendment_proposal": null
}
